Company,Date Posted,Description,Experience Required,Experinece Required,How to apply,Job Role,Job type,Job_id,Link,Location,Package Offered,Package offered,Posted since,Source
HireSpeak,Mon Nov 05 16:23:44 UTC 2018,"Position Overview
Extraordinary opportunity that truly achieves professional growth and work/life balance.
Highly competitive compensation and benefits.
Collaborative, collegial team environment.
The Senior Software Engineer (SSE) is a leading advocate for advancing the company’s market proposition of developing quality software whose functionality exceeds customers’ expectations. S/He is a prolific full-stack developer and coding guru that supports the IT Director and the C-Suite with managing the department’s daily operations, executing long and short-term strategic initiatives and software development projects as assigned, within a matrix organizational structure. The SSE:


Plays a pivotal role in assuring that QA best practices and secure coding architecture is woven throughout the fabric of our software development and product life-cycles.


Resolves routine programming problems and clarifies related issues and, when possible, converts them into “teachable moments” for the benefit of staff, management and clients alike.


The SSE stays current and in-sync with the latest industry trends, best practices and new developments. Through professional development, independent learning and research, peer engagements and professional memberships, the SSE continuously expands his/her professional skills. S/He is a departmental evangelist for the acquisition and adoption of leading-edge software development technologies that can help deliver the exceptional advantage to our product design and end-user experiences.


Manages and mentors lower-level programmers and IT team members to ensure the highest quality work product and professional/skill growth.


Assists with fostering the department’s collegial spirit and collaborative environment throughout the company and at points of engagement with the company's external audiences, including, clients and their customers, with whom the department interacts.


Responsibilities
The SSE participates with management and the C-Suite as an active leader/stakeholder in existing and future product development and feature design as well as the management of secure software architecture. In addition to actively authoring new code, under the direction of the IT Director, the SSE also:

Assures optimization of UI design and the overall UX.
Manages QA processes, testing and oversight.
Reviews and approves changes to the codebase.
Leads the design and specification process for new product modules and features.
Reviews, designs and upgrades systems architecture.
Optimizes platform at system, database, and component levels.
Works with other departments and clients to identify and spec future system enhancements.
Assists in the research and analysis of existing systems and programming requirements to develop
solutions and implement programming enhancements/fixes.

Required Skills / Qualifications
The SSE is adept at managing the software development life cycle and infrastructure support services relevant to SaaS development and production environments and is highly proficient in the design and management of software QA testing. S/He is an ""ace"" coder that possesses superior written and verbal communication skills along with the ability to interact with a wide range of internal and external audiences. The SSE is a “master” at identifying, analyzing and articulating both the technical and business case in a manner that promotes deeper understanding of and fosters greater creativity towards implementing optimal solutions to software development, organizational and market challenges. The SSE has:
More than 7 years’ programming experience that includes:

HTML5
CSS3/Sass/Less
SQL
Java
JavaScript (Including Babel/ES5/ES6/npm)
Java EE/JSP/Spring
Drafting moderate to highly complex program specifications

No less than 5 years’ experience that includes:

Code QA and testing
Mobile programming
Responsive Design
Drag and drop design technology
OS production server administration
Version control technology
Web service/RESTful interfaces
AWS, Windows, LINUX, GitHub, Spring, Agile, SCRUM

No Less than 3 years’ experience with three or more of the following:
Maven, Selenium, Jenkins, Prometheus, Grafana, JIRA
",,--,"All applications are held in the strictest confidence.
Send a cover letter that includes your salary requirement and a copy of your resume to hrsupport@hirespeak.com.
ALL submissions must have both a cover letter and resume with salary requirement.
hirespeak.com is the job listing proxy for this confidential listing
",Senior Software Engineer-Confidential,Full Time,f4e46e80-e116-11e8-8fac-aba5b4c6653c,https://jobs.github.com/positions/f4e46e80-e116-11e8-8fac-aba5b4c6653c,"Baltimore, MD",--,,--,Github Jobs
VONQ,Mon Nov 05 13:39:28 UTC 2018,"Build new product solutions and solve complex problems in the field of Data Engineering. That’s what you love to do! Being part of VONQ’s Engineering team means adding value and making positive impact on the market. You find AI in general and machine learning in particular. Intriguing? Apply for Data Engineer at VONQ in Rotterdam!
Senior Data Engineer with Spark / Scala
Rotterdam, fulltime, ASAP
Work on a unique product and deal with Data Engineering challenges every day!
As our Sr. Data Engineer you’ll have a huge contribution to our core product: the Job Marketing Platform (JMP). It’s a big data-driven application with a recommendation engine to help recruiters market jobs online. The platform is used daily by many clients, and we have an ambitious roadmap to build it out further!
Your main responsibility is to develop and improve our data platform, which consists of various components - from ETL, machine learning and real time streaming data pipelines to web services aimed to provide our consumers valuable processed information. We integrate various data sources, from internal stored data (in Elastic, MySQL, Postgres, S3, etc) and tracking systems (Snowplow), to external integrations using 3rd party data.
How you get the job done

Work in a multidisciplinary agile team
Take part in critical product design &amp; architecture efforts and be hands-on with the implementation. This covers the entire stack, including also infrastructure and platform related efforts
Develop scalable data applications, ETL, Machine Learning &amp; Analytics processing pipelines
Contribute to environment setups/configs and tools for resources efficiency in order to solve complex business tasks
Design and develop microservices for data consumers
Challenge, provide guidelines, and mentor junior/medior team members

You will be part of an international and experienced Engineering department consisting of Backend and Frontend Developers, Data- and DevOps Engineers, Designers, an Agile Coach and a CTO.
What our perfect picture looks like
This describes the ideal candidate, but above all, we value people that are eager to grow, autonomous, work together, and love to get things done!

3+ years of experience in Data Engineering and an Agile mindset
Bachelor degree or equivalent relevant work experience
Excellent communication skills in English
Strong hands-on experience in building data solutions (ETL batch and streaming pipelines, ML, micro-services)
Strong experience with programming in Spark (using Scala) in production environments is required
Experience in using web tracking and message-queue technologies, databases and text search indexes) is strongly desirable
A DevOps mind- and skillset: experience with CI/CD, AWS infrastructure, Kubernetes, Docker and Databricks platform is a huge plus

Bonus points!

Good knowledge in Machine Learning algorithms and knowing how to apply them to solve business problems is much appreciated. You’ll work closely with our Data Scientist, hence developing and facilitating the roll-out of machine learning models into production should not be “strange” to you
Productionizing machine learning models using off-the-shelf technologies is a plus

This is why you can’t miss out on this opportunity
There’s never a dull moment at VONQ’s Engineering team! While you are working your data magic, you’ll get freedom and space to design and implement solutions that you believe are good for the business. In fact, we encourage you!
We have legendary company outing, beers on Friday and lots of FUN!
There is more! We offer:

A good salary, 8% holiday allowance
100% commuting expenses compensation
Flexible working hours and unlimited (paid!) holidays
Pension contribution
Time and budget for training
Relocation support and more!

Are you up for the challenge? Apply by clicking on this link: https://vonq.redirect.your-jobresponse.com/s/235299/V819/solliciteren. Questions? Get in touch with Sarah Ellithy (Recruiter) -&gt; sarahellithy@vonq.com.
Keywords: Rotterdam, vacancy, engineer, engineering, data, developer, architect, analyst, spark, scala
",,--,"https://vonq.redirect.your-jobresponse.com/s/235299/V819/solliciteren
",Senior Data Engineer with Spark / Scala,Full Time,257a9838-e100-11e8-8338-76424afb236d,https://jobs.github.com/positions/257a9838-e100-11e8-8338-76424afb236d,Rotterdam,--,,--,Github Jobs
Live Graphic Systems,Sat Nov 03 06:31:26 UTC 2018,"Who we are
LiGr systems is a growing startup in the sports and media tech industry which creates automated, real-time data-driven graphic displays (scoreboards, team lists, infographics) for sports organisations from grassroots to professional for use primarily over live video broadcasts.
Who we're looking for:
This is a unique opportunity to build exciting, bleeding edge technology in the sports and broadcast industry, and we are looking for a talented, experienced javascript/web engineer to join our team and help build on our ideas.
The successful applicant will be able to assist us in meeting the challenges of scale as we expand our operation internationally. You will have an immediate opportunity to influence the product strategy and organisational culture.
Successful candidates will be invited to meet our leadership team in person or over video chat.
The following skills are required
Strong engineering ability,
Fluent / Advanced English,
Excellent practical problem-solving,
A passion for software,
Great written communication skills,
Organisational skills,
Continuous Learner,
Ability to work unsupervised
The following skills are highly valued
Cloud infrastructure e.g. containers(docker), Kubernetes, GCP, cloud functions,
React, webpack, babel, redux
Svg, gsap, animation/motion graphics
Event-driven architectures, event sourcing,
Testing unit/integration/e2e/CI/CD,
Understanding of design systems,
CSS
The following is also valued
Some understanding of sport,
Video streaming - encoding/hls/rtmp/storage/facebook/youtube
Our current stack:
React,
Node.js,
Docker,
Kubernetes,
GCP,
Google Firestore
What you”ll be doing
Creating web interfaces/content management systems,
Implementing graphic components,
Improving event-driven architecture and building backend services
Benefits of the role
In addition to being a part of a great team, working in a fun and creative environment and learning from the best technical minds in the sports industry, we offer:
Competitive salary,
Access to the latest tools and technologies,
Work with global sporting bodies and sports leagues,
Remote work with a virtual and regular communication environment (Trello, Slack, Github etc),
Start-up sized company, where you can make an immediate impact,
Build software that will have a global impact on sports and the future of sports broadcast,
Our team is technical and understands developer needs
Apply
Applying is easy. Send an email with your resume, website, Github account, links to apps or anything else you're proud of. If we like what we see, we’ll get in touch and organise a catchup in person or over video chat. We’ll then tell you more about the role and we can decide if there's a fit.
Email applications to luke@ligrsystems.com
",,--,"Email luke@ligrsystems.com
",Senior Full-Stack Javascript Engineer,Full Time,e10970ae-df31-11e8-8043-db2f2a1252c8,https://jobs.github.com/positions/e10970ae-df31-11e8-8043-db2f2a1252c8,Australia and/or Remote,--,,--,Github Jobs
Jun Group,Fri Nov 02 19:02:51 UTC 2018,"The word JUN means truth, and our culture is about openness and honesty. Our mobile ad platform delivers millions of engagements across devices for clients like Intel, LG, Zynga, EA, and TechCrunch. These brands rely on us to reach their audience because everything we do is brand safe, viewable, and transparent.
We are looking for a senior software engineer to join our amazing server team. This position is full-time, on-site in our New York headquarters, and will report to the Director of Server Software Development. Jun Group will only consider candidates for this position who are currently legally authorized to work in the United States.
Who you are

You enjoy a fun, creative, and engaging working atmosphere free of brilliant jerks
You want to be part of a small team inside a large company with massive opportunity for growth
You enjoy collaboration with other teams including product, biz dev, and our in-house QA team
You eagerly dig into complex engineering problems

What we do

Write scalable back-end and front-end code in JRuby, Java, and JavaScript
Experiment with new tech to find the right tool for the job
Maintain high code quality through code reviews and automated tests
Use Kanban to manage multiple releases per week
-Participate in and improve Dev Ops for our primary revenue generating applications

How we do it

Ruby/Rails
JavaScript (JQuery, AngularJS, Vue.js)
IntelliJ IDEA / TeamCity
AWS (EC2, EB, RDS)
Google Cloud (BiqQuery, Dataflow, Cloud Functions)
MySQL

What we offer

A highly competitive compensation package
401k with company match
Paid vacation, work from home, and sick days
Annual personal development budget to attend a conference of your choice
Designated time to work on the company-related projects you feel strongly about
Macbook Pros, dual monitors, and a quiet working space
Catered lunch at least once a week
Monthly company events

Jun Group sets the standard for premium online advertising. We work hard, and we have lives, too. We'll pay top dollar for the right person, and there are plenty of perks. Interested parties should send a resume along with a cover note explaining why you’re right for the job.
Total compensation is based on experience. We welcome diversity and non-traditional paths into the developer profession, and advocate strongly for hiring the right person as opposed to the right combination of keywords.
",,--,"https://grnh.se/06736d9f2
","Senior Software Developer, Server-Side Technologies",Full Time,cdd3b306-ded1-11e8-9d57-a9ea0396f64e,https://jobs.github.com/positions/cdd3b306-ded1-11e8-9d57-a9ea0396f64e,"New York, NY",--,,--,Github Jobs
Aera Technology,Fri Nov 02 13:22:25 UTC 2018,"Do you want to shape the future of enterprise software?
At Aera Technology, we apply Internet scale technology to the challenges facing enterprise businesses. Think of the self-driving car: connected, always-on, thinking, and autonomous. Our mission is to enable companies in the same way.
We're hiring exceptionally talented UI developers to join our top-notch engineering team. This is a great opportunity to be part of a team developing cutting-edge enterprise cloud platform. You must be highly motivated, independent, result oriented and enjoy working in a start-up atmosphere.
Responsibilities

Develop new features and components in our existing web application.
Build reusable code and libraries for future use.
Work with PM and UX designer to understand the requirement and ensure the technical feasibility of UI/UX design.
Optimize application for maximum speed and scalability.
Learn and research latest JavaScript frameworks and work on PoC projects to integrate and upgrade existing application.
Collaborate with other team members and with cross-functional teams and stakeholders across geographies.
Create and execute unit test cases and contribute to test automation.
Participate in design and code reviews.

About You

A passion for UI/UX
You are an experienced UI developer with a proven track record of delivering great software.
Experience with HTML, CSS, HTML5, OO Javascript, modern frameworks such as ReactJS, Polymer, VueJS or ExtJS/Sencha.
Experience with NodeJS, Browserify, Babelify, Gulp, Bower.
An ability to write code for responsive UI and implement common widgets.
Have a passion for quality and writing clean, solid, readable code that scales and performs well.
A firm grasp of Computer Science fundamentals including object-oriented design, data structures, algorithm design, problem-solving, and complexity analysis.
Experience with Java, Rest API is a big plus.
Experience with cloud services. Experience with microservices would be a bonus.
An urge to collaborate with other architects, designers, product managers, and software developers to influence product direction and functional requirements.
Ability to coach and collaborate inside and outside the team - You enjoy working closely with others, teaching, and learning, and are comfortable showing off your work.
Have a positive energy and enthusiasm - cultural fit is a big deal for us, we’re looking for smart people who are excited about solving big problems and are self-motivated to get things done.
Are highly organized and have a professional attitude towards work - You're an exceptional communicator, you are pragmatic, and you know how to build trust.

At Aera, we're on a mission to solve the biggest, most intractable challenges of enterprise software. We envision the rise of the Self-Driving Enterprise: a more autonomously functioning business with a central operating system that connects and orchestrates business operations. Our platform is increasingly used by the world's largest companies to identify and respond to market opportunities faster.
If you share our passion for building the next generation of enterprise software and implementing it for the most sophisticated customers in the world, you’ve met your match. Headquartered in Mountain View, California, we're growing fast, with teams in Mountain View and San Francisco (California), Portland (Oregon), Bucharest and Cluj-Napoca (Romania), Paris (France), Munich (Germany), London (UK), Pune (India), and Sydney (Australia).  So join us, and let’s build this!
",,--,"Apply here: https://bit.ly/2Jx6mmO
",Senior User Interface Software Engineer,Full Time,2d215050-dea2-11e8-9a31-2431d393de1e,https://jobs.github.com/positions/2d215050-dea2-11e8-9a31-2431d393de1e,Bucharest,--,,--,Github Jobs
Sanoma Pro Oy,Fri Nov 02 08:06:37 UTC 2018,"Developer - Interested in AI, machine learning and the future of learning? Join Sanoma Pro and its pioneering in-house development team that is about to digitalize the learning experience. Learning is no longer tied to any specific place or device, and learning paths are becoming individual. The transformation calls for new kinds of solutions to meet the needs of teachers, learners and their parents.
What we have to offer is a job in which you can be part of making a dent in an industry. Let’s combine our vision, your knowhow and work together to develop something new that will be used by hundreds of thousands of people every day! You will be working in our truly international team and collaborate with other Sanoma Learning countries.
We develop our solutions currently using Java, Amazon Web Services, JavaScript, Angular, HTML5, CSS3, MongoDB, Scrum, SAFe. As a Lead Developer you can influence this list.
A successful candidate


masters technologies listed above (or has the capability to pick up new ones quickly)


knows how to design maintainable, secure software for large masses both in the back-end and front-end


has a customer-centric approach, believes in prototyping and design-thinking


has passion for continuous learning, challenging oneself and others, mentoring


has years of experience from agile software development projects


is a firm decision maker with an ability to listen and to collaborate


communicates fluently in English with the team and its stakeholders


The job is located at Sanoma’s offices in Ruoholahti, Helsinki.
We will offer a competitive compensation package, possibility for learning and training, and challenging work in an extremely skilled and motivated team.
Please include your CV, a short motivation letter along with your salary request and a possible link to your GitHub/Bitbucket or similar. Please contact Arja Martikainen +358 40 7621564 or arja.martikainen(at)barona.fi for further information. Please submit your application by 30h of November 2018.
",,--,"arja.martikainen@barona.fi
",Lead Developer,Full Time,00d88332-de76-11e8-8013-c709d4006bc8,https://jobs.github.com/positions/00d88332-de76-11e8-8013-c709d4006bc8,"Helsinki, Finland",--,,--,Github Jobs
RBS,Fri Nov 02 07:55:22 UTC 2018,"We're looking for a Senior Automation Test Analyst to join us in Bristol
This role will see you undertaking testing activities to agreed timescales, cost and quality to prove that solutions satisfy customer needs and business operating principles
You'll utilise your expertise and specialisation in automation testing
You'll be joining our exciting and cutting edge Bristol digital hub in Commercial &amp; Private Banking Change, able to really make your mark in this area
What you'll do
The testing you'll work on can relate to all or specific stages of the project life cycle including functional testing - regression and exploratory- and non-functional testing - performance and accessibility. You'll analyse and understand testing requirements, and collaborate with colleagues to plan and manage the work necessary to perform and deliver testing for projects.
Your role will involve:
Working to deliver with enterprise level test automation frameworks supporting Behavioural Driven Development (BDD)
Testing web applications both on the UI and by driving the underlying micro-services
Reviewing design documents, business requirements and non-functional requirements across multiple scrum teams to build test scenarios for automation
Contributing and reviewing documents such as test automation strategy, framework designs, best practices, coding standards, test plans and test completion reports
Proactively sharing and reporting risks, issues, challenges, blockers and forthcoming tasks to the scrum master or test lead
Understanding RAID logs and managing them to ensure that there is no leakage into production
The skills you'll need
We're looking for someone with experience working in an Agile environment, with great stakeholder collaboration abilities. You'll also have practical experience of enterprise level requirement analysis, scenario construction, script writing, test execution and RAID management.
You'll be proficient with:
Selenium Webdriver (with Java)
Cucumber JVM
Java 8 coding
IntelliJ IDE
Git / Stash
You'll also show knowledge of:
JIRA, Zephyr and Confluence
Tool-aided web-service testing and load testing tools
Remote and distributed test execution
Scrum and Kanban
How we'll reward you
In return, we offer a competitive salary and you'll also join our retirement savings plan. You can also choose from a selection of protection, healthcare or lifestyle extras from RBSelect, our fully flexible reward programme.
Visit our reward and benefits page for more information on the benefit packages we offer.
Inclusion
At RBS, we want everyone to feel welcome, regardless of your background or needs. If you need adjustments making to your working environment, we’ll do everything we can to support you. As part of this commitment, we offer flexible working options for some of our roles - find out more.
As a Financial Services organisation we comply with and support the requirements set by our Regulator, the Financial Conduct Authority (FCA), which are designed to protect our customers. This role falls under Conduct Rules of the Individual Accountability Regime (IAR) and is subject to pre-employment screening. This means if your application is successful, you’ll need to satisfy some important background checks before you can start working with us. These will include a full credit check, a criminal record check, residency and right to work checks.
",,--,"Apply here: https://jobs.rbs.com/jobs/2987679-senior-automation-test-analyst?bid=4846
",Senior Automation Test Analyst,Full Time,a68e7a7c-de74-11e8-9ba1-aaa4059ab193,https://jobs.github.com/positions/a68e7a7c-de74-11e8-9ba1-aaa4059ab193,"Bristol, United Kingdom",--,,--,Github Jobs
