Company,Date Posted,Description,Experience Required,Experinece Required,How to apply,Job Role,Job type,Job_id,Link,Location,Package Offered,Package offered,Posted since,Source
Billie GmbH,Mon Jun 15 15:58:08 UTC 2020,"Hi! We are Billie.
We are a breakthrough Fintech startup in Berlin that aims to revolutionize small business financing. We have a world-class team on the ground and some of the strongest investors in Europe backing our company. Based on big data analytics, fully digitalized processes and a highly scalable state of the art tech platform, we offer the simplest and fastest way for small businesses to access capital. Our innovative solution provides financing against open invoices of small businesses – no hidden fees, no paperwork, no boring bank branches.
We are a tech company creating financial products, not a financial company that just makes some software. Our purpose is to create freedom through innovation, and that means using tech and automation to empower our teams to deliver meaningful, creative work and results. We love building simple and elegant solutions and we strive for automation today and for scalability now.
Tasks
Billie is moving fast towards a microservice architecture written mainly in PHP 7(Symfony4), a bit of Python and a bit of GoLang. The services talk to each other using REST, RabbitMQ and GraphQL. Data is stored in MySql and SnowFlake, we have no legacy code and we are always eager to update our stack to the newest versions.
We currently have several openings for experienced PHP 7 Back-End engineers in our Agile cross-functional teams. We are also looking for strong People Leaders with strong engineering backgrounds to join us in Berlin.
Requirements

5 years of relevant industry experience as a Software Developer.
Deep understanding in at least one backend language (PHP 7, Symfony 3 or 4).
Sound knowledge in relational database systems (preferably MySql).
Experience with agile engineering practices such as TDD, BDD, and CI/CD.
Good understanding of REST and RabbitMQ or similar queues.
Innovative and self-motivated, with strong problem-solving skills.
Team player, proactive and result-driven.
Full professional proficiency in the English language.

NICE TO HAVE:

Experience building complex software systems that have been successfully delivered to B2B customers is a plus.
AWS services knowledge is a plus.
Experience working with highly complex back-end systems, especially in the financial industry, is a plus!
Immediate availability to start is preferred.

ARE YOU A PEOPLE LEADER?
Have you been focusing on People and Team Management for at least 3 years? You may be well suited for one of our Team Lead roles. Regardless of your title (Team Lead of course, but also Agile Coach, Scrum Master, Project Manager, Software Development Manager, etc.) if you have 3 or more years of experience in leading Tech Teams, you love coaching, mentoring and providing feedback to team members, and you have tech skills near to our stack, we would like to meet you as well!
Benefits

The opportunity to be a part of one of the fastest-growing Fintech startups in Europe with a great mission: empower small businesses through automation and innovation!
One of the most competitive virtual shares incentive schemes in the German market.
A great office near Checkpoint Charlie with free gym, healthy snacks and cereals, fruits, coffee and drinks (We actually have a full fledged Italian-style espresso machine and you can grind the beans fresh right there!)
Yearly personal development budget for you to get books, courses, participation in conferences and whatever you think you need to become better as you grow with us!
Relocation bonus if you have to move to Berlin. We also offer free German classes.
25 vacation days per year, extra day off during the Christmas/NY holidays, flexible hours (or: “freedom with responsibility”) and Work from Home availability.
Becoming part of an international team of highly motivated, experienced, and skilled top performers where hierarchies don't matter, but passion and drive do.
No legacy code, work in nimble cross-functional teams with open communication lines across the company.
You’ll be surrounded by smart people with a wide variety of backgrounds from which you can learn and that also want to learn from you!
A fantastic learning opportunity to develop your knowledge in the FinTech space.

",,--,"https://billie.join.com/jobs/1116327-php-back-end-engineers-and-team-leaders-location-berlin-fintech-startup?pid=357a3b4531918760973f&amp;utm_source=github_jobs&amp;utm_medium=paid&amp;utm_campaign=single%2Bposting&amp;utm_content=php%2Bback-end%2Bengineers%2Band%2Bteam%2Bleaders%2B-%2Blocation%2Bberlin%2B-%2Bfintech%2Bstartup
",PHP Back-End Engineers and Team Leaders,Full Time,f37e1881-4696-4e87-81a9-0f70b93e949e,https://jobs.github.com/positions/f37e1881-4696-4e87-81a9-0f70b93e949e,Berlin,--,,--,Github Jobs
Microsoft,Mon Jun 15 10:12:19 UTC 2020,"Are you a great Software Engineer? Do you like working on technology problems which impact people on a global scale? Would you like to work on complex problems that help users find and utilize solutions in Office? If your passionate about having our users have the best Office experience and you like working across both consumers and enterprises for PCs, tablets, and phones then maybe the Office OMEX team has the right job for you.
As the industry undergoes a profound transition to services and devices, we are at the heart of re-inventing how Office is delivered and maintained for consumers and enterprises. Office is one of the biggest platforms on the planet, we are looking for engineers who are passionate about ensuring that our users enjoy the latest and greatest Office version. This requires great strategic and creative thinking as well as an ability to understand the customer, technology, challenges and opportunities. Our O365 OMEX (Office Modernization Experiences) team are looking for a great Software Engineer to drive and define this transition &amp; foster an engineering culture that has customer-centered services &amp; releases as part of its core DNA.
Responsibilities
What you will be responsible for:

Working in a combined engineering organization to drive design, development, testing and release of client/services that enhances customer experiences
Helping evolve development guidelines, practices &amp; principles for a world where client and services development &amp; delivery is moving faster than ever
Designing resilient, scalable and easily maintainable software
Fostering a data driven approach to everything we do

Qualifications
To be successful in this role, you'll probably have:

Object-oriented design, coding and testing patterns
Strong coding skills in C# or other object-oriented languages.
4+ years of industry experience designing, building, testing &amp; shipping software
Strong problem solving skills and are comfortable in dealing with ambiguity
Ability to handle competing priorities in fast paced environment
A natural passion &amp; drive to lead by example
An ability to perform at a high level in a fast paced, dynamic environment
Strong leadership and communication skills

Here's what we will provide for the right candidate:

Opportunity to make an impact on our changing business
New engineering challenges to grow and enhance your skills
Be part of a team that is defining and building great products that are used by millions of people
Level of ownership and autonomy via a role that enables you to have strategic impact
A very competitive package commensurate with a role of this caliber and impact. Microsoft is an equal opportunity employer and supports workforce diversity

Click here to apply!
We would like to welcome you in an international working environment that is characterized by flexibility, an informal atmosphere, and a fast pace. Microsoft ensures your work-life-balance, offers attractive salary packages and bonus programs and a modern office, which combines innovative technics with design.
Microsoft is an equal opportunity employer. All qualified applicants will receive consideration for employment without regard to age, ancestry, color, family or medical care leave, gender identity or expression, genetic information, marital status, medical condition, national origin, physical or mental disability, political affiliation, protected veteran status, race, religion, sex (including pregnancy), sexual orientation, or any other characteristic protected by applicable laws, regulations and ordinances.
Benefits/perks listed below may vary depending on the nature of your employment with Microsoft and the country where you work.
",,--,"Click here to apply!
",Software Engineer,Full Time,c0c42e4c-99bf-41f2-a90f-35cb7d8c2014,https://jobs.github.com/positions/c0c42e4c-99bf-41f2-a90f-35cb7d8c2014,Dublin,--,,--,Github Jobs
MindsDB,Mon Jun 15 07:23:47 UTC 2020,"Machine Learning Research Engineer
We are building MindsDB, an open-source explainable AutoML tool. We want to give everyone the ability to make informed predictions, using state-of-the-art ML models, with just a few lines of code.
We're looking for Machine Learning experts to join us in the journey of bringing state of the art Machine Learning to everyone.
You will be part of our Machine Learning team, with a focus on designing and implementing end-to-end Machine Learning workflows, we have a strong focus on explainability, so a lot of the work you will be doing will involve making sure that the Machine Learning models that our system generates, can explain to all (including non-technical people) where they should and should not trust the model when the model predict something, why are they making such predictions and to understand what within the data used should be of interest.
Since our project is Open Source, we encourage you to take a look at it: https://github.com/mindsdb/mindsdb &amp; https://github.com/mindsdb/lightwood.
You are confident that you can solve the following challenge:
https://github.com/mindsdb/lightwood/issues/169
We are looking for a team member that is:

Eager to understand things and experiment.
Good at working with minimal supervision in a remote environment.
Excited by discussing, deconstructing and challenging ideas.
Good at communicating in English, don't worry, you don't need to be a native speaker or a poet.
An overall good programmer, especially with Python 3Qualifications:
Strong understanding of machine learning and artificial neural networks, for example through active research in a related PhD program or experience in research labs.
Experience working with Pytorch is required.
Papers in academic conferences (NeurIPS, ICML, ICLR, AAAI or domain-specific conferences).

Most important of all, is that you actually like MindsDB and believe in what we are trying to accomplish. We want to democratize Machine Learning and we want to make it explainable, most ML solutions out there focus on just making predictions, we also focus on the question:

What is interesting in my data and why?
When should I not trust this model and why?
How can I improve this model?
Why did the model give this prediction?

MindsDB is an equal opportunity employer. All qualified applicants will receive consideration for employment without regard to age, ancestry, color, family or medical care leave, gender identity or expression, genetic information, marital status, medical condition, national origin, physical or mental disability, political affiliation, protected veteran status, race, religion, sex (including pregnancy), sexual orientation, or any other characteristic protected by applicable laws, regulations and ordinances.
Interested? You can apply via the application form.
Agency calls are not appreciated.
",,--,"Click to apply
",Machine Learning Research Engineer,Full Time,2acc9ea1-908e-4881-a351-3f5d4bf96a7f,https://jobs.github.com/positions/2acc9ea1-908e-4881-a351-3f5d4bf96a7f,"Berkeley, CA, US",--,,--,Github Jobs
BlueVolt,Fri Jun 12 21:52:25 UTC 2020,"Position Summary
BlueVolt is growing. We have excellent product-market fit with loyal customers. We have thousands of customer admin users and hundreds of thousands of learner users. We are known in the skilled trades for our simple, effective learning platform and strong service ethic. We help companies turn learning into a strategic asset. We build strong relationships, growing and learning from our customers as they grow and learn from us.
We're looking for someone to take on the responsibility to help develop software that customers love while working in an Agile development environment. You'll help ensure high quality standards and will work with the team to develop effective processes for managing all aspects of software development. You will be a core contributor to the platform and will participate in other software and infrastructure projects as needed.
Responsibilities

Develop software on a fully cloud-hosted SaaS product.
Design and author highly functional and aesthetically pleasing software for our product lines, including the BlueVolt LMS, web portals and other software projects.
Develop client requirements, estimate, advise upon, and deliver the appropriate solution.
Improve configuration management practices and development processes.
Develop automated tests and follow Test-Driven Development practices.
Provide technical support, training, and subject matter expertise to clients and BlueVolt employees.
Help build development team guidelines and reinforcement their practice.
Work with management and team on identifying obstacles and removing them

Requirements

5+ years of experience with the .NET platform
Excellent object-oriented design &amp; programming skills, including the application of design patterns and avoidance of anti-patterns
Experience working in a collaborative team of application developers and source code repositories. TFS is preferred
Solid programming experience with C#, WCF, Restful services using WEB API, and ASP.NET MVC.
Experience with SQL and SQL Server Database Programming
Experience with JavaScript, JQuery, AngularJS and Angular
Experience with TDD using nUnit and MS Test, Auto Tests (Selenium is preferred)
Agile/SCRUM Software Development Process
Excellent written and verbal communication skills
Good team player

Bonus Points:  Azure expertise a Plus
Note: No H1/H1B/F1 Visa transfer sponsorship available for this opportunity, no new sponsorship applications.
Location:  Portland, OR
",,--,"https://jsco.re/6n8ba
",Senior Software Engineer (.NET),Full Time,8db5942d-34bb-44c0-8d86-31ba6a2464a6,https://jobs.github.com/positions/8db5942d-34bb-44c0-8d86-31ba6a2464a6,"Portland, OR, US",--,,--,Github Jobs
Lawrence Berkeley National Laboratory ,Fri Jun 12 21:15:38 UTC 2020,"Web Developer (The Materials Project) - 90287
Organization:  ED-Energy Storage &amp; Distributed Resources
Berkeley Lab’s Energy Storage &amp; Distributed Resources (ESDR) Division has an opening for a Web Developer to join the Materials Project!
In this role, you will work in a small team composed of both computer scientists and materials scientists, a team that will continue to grow and evolve as our fast-paced project pushes new boundaries. We are seeking web developers and designers who are versatile and passionate about both the front-end, ready to tackle new problems as we continue to push technology and science forward.
Be part of the revolution in scientific and technological breakthroughs brought on by advanced computing.  We are looking for someone with the desire and imagination to drive the Materials Project in new and exciting directions as the number and diversity of our simulations grow.
The Materials Project (www.materialsproject.org) is a leader in the new wave of ""data-driven science"" that is already affecting how thousands of scientists, many of them world leaders in their fields, connect, explore, and interact with information and one another. We use millions of CPU-hours a year to compute the properties of advanced new materials, and disseminate the information with web interfaces and APIs.
What You Will Do:

Develop and manage the Materials Project website: www.materalsproject.org

Develop responsive front-ends for scientists ranging from undergraduate students to senior researchers and professors.
Optimize website design for usability, scalability, and speed.
Write well designed and testable code in HTML/CSS/JS.
Employ continuous integration and deployment practices to ensure code quality and rapid development of new features.
Utilize website testing and web analytics to optimize website performance.
Develop new means of exploring, visualizing and sharing materials data.
Design and implement new “apps” for new types of materials analyses, such as assessing next-generation battery properties or stability of CO2 capturing catalysts in water.
Expand the project to new territories, such as crowdsourced discovery of new materials and ""sandboxes"" for private exploration of interesting chemical compounds.
Participate in discussions with science teams, workshops, and weekly meetings.

What is Required:

Bachelor’s Degree in Computer Science or a related discipline and a minimum of 5 years of related technical experience or an equivalent combination of education and experience.
Experience writing HTML, CSS and modern JavaScript (ES6) or TypeScript.
Experience building web sites with modern frontend web frameworks such as React, Angular, or Vue.
Experience working collaboratively using Git-based workflows.
Experience developing CI/CD pipelines for web projects.
Experience with Containerized service deployments.
Knowledge of User interface design principles and API Protocols including REST.

What We Prefer:

Master’s Degree in Computer Science or a related discipline.
Experience with mockup/wireframe/prototyping tools.
Knowledge of Authentication protocols and standards such as OAuth, OpenID and CAS.
Experience with NoSQL databases with MongoDB.
Experience with Firewall configuration.
Experience with Log analysis.

The posting shall remain open until the position is filled, however for full consideration, please apply by close of business on June 30, 2020.
This posting was updated on 06/11/2020.
Notes:

This is a full time, M-F, exempt from overtime pay (monthly paid), 1 year, Term appointment with the possibility of renewal for a total of 5 years or conversion to Career appointment based upon satisfactory job performance, continuing availability of funds and ongoing operational needs.
Salary is commensurate with experience.
This position may be subject to a background check. Any convictions will be evaluated to determine if they directly relate to the responsibilities and requirements of the position. Having a conviction history will not automatically disqualify an applicant from being considered for employment.
Work for this position will be primarily performed at Lawrence Berkeley National Lab, 1 Cyclotron Road, Berkeley, CA however the option of working remotely may be considered but is limited to individuals residing in the United States.

How To Apply
Apply directly online at http://50.73.55.13/counter.php?id=182299 and follow the on-line instructions to complete the application process.
Berkeley Lab (LBNL, https://www.lbl.gov/) addresses the world’s most urgent scientific challenges by advancing sustainable energy, protecting human health, creating new materials, and revealing the origin and fate of the universe. Founded in 1931, Berkeley Lab’s scientific expertise has been recognized with 13 Nobel prizes. The University of California manages Berkeley Lab for the U.S. Department of Energy’s Office of Science.
The ESDR Division (https://appliedenergyscience.lbl.gov/) works on developing advanced batteries and fuel cells for transportation and stationary energy storage, grid-connected technologies for a cleaner, more reliable, resilient, and cost-effective future, and demand response and distributed energy technologies for a dynamic electric grid.
Working at Berkeley Lab has many rewards including a competitive compensation program, excellent health and welfare programs, a retirement program that is second to none, and outstanding development opportunities.  To view information about the many rewards that are offered at Berkeley Lab - Click Here (https://hr.lbl.gov/).
Equal Employment Opportunity: Berkeley Lab is an Equal Opportunity/Affirmative Action Employer. All qualified applicants will receive consideration for employment without regard to race, color, religion, sex, sexual orientation, gender identity, national origin, disability, age, or protected veteran status. Berkeley Lab is in compliance with the Pay Transparency Nondiscrimination Provision (https://www.dol.gov/ofccp/PayTransparencyNondiscrimination.html) under 41 CFR 60-1.4.  Click here (https://www.dol.gov/ofccp/regs/compliance/posters/ofccpost.htm) to view the poster and supplement: ""Equal Employment Opportunity is the Law.""
Lawrence Berkeley National Laboratory encourages applications from women, minorities, veterans, and other underrepresented groups presently considering scientific research careers.
",,--,"http://50.73.55.13/counter.php?id=182299
",Web Developer (The Materials Project) ,Full Time,f1759f8d-107a-4dea-8114-b561fdb586ee,https://jobs.github.com/positions/f1759f8d-107a-4dea-8114-b561fdb586ee,Berkeley,--,,--,Github Jobs
