Company,Date Posted,Description,Experience Required,Experinece Required,How to apply,Job Role,Job type,Job_id,Link,Location,Package Offered,Package offered,Posted since,Source
SunteckTTS,Fri Nov 16 16:34:22 UTC 2018,"Requirements:















Nice to Haves:








About the Role: 
You will be responsible for contributing to the technical design, development, and implementation of the SunteckTTS application ecosystem. The role involves more than just writing production code; in a typical week, you could be: brainstorming technical architecture options, providing feedback to improve our development processes, reviewing PRs from other team members, fixing a bug you randomly came across, or improving unit test coverage.
We’re looking for an outstanding Senior Developer with a desire to participate in a growing team with the skills, experience, and understanding to join a small, but strong development team. In order to meet the many challenges and high volume work of the SunteckTTS users, it is important for the Senior Developer to have excellent communication.
About SunteckTTS and the Team:
SunteckTTS is an industry-leading, full-service, transportation logistics provider that operates through a network of sales, operations, and capacity specialists. We are a billion dollar company with over 200 independently owned and operated agent offices across the U.S. and Canada.
We focus on providing asset and non-asset surface transportation to a wide range of end-use markets, including food, lumber, paper, printing, textiles, electronics, machinery, government, and more. The Application Development Group is in the midst of an ambitious program to create best in breed software products and improve existing systems for our user base. Our team of Business Analysts and Developers share a culture of self-ownership and open communication to provide
maximum business value. We strive to ensure team-based component ownership, development, and quality assurance. We are a tight knit group that relies on ability and flexibility to ensure we balance our strides towards improved process and need to meet the priorities of a heavily used
enterprise system. The Application Development Group focuses on a culture of open communication, learning, and transparency.
SunteckTTS is an Equal Opportunity Employer and does not discriminate against qualified applicants with regard to race, color, religion, age, sex, national origin, handicap, sexual orientation or veteran status.
",,--,"Email your resume to:
anthony.vargas@suntecktts.com
",Sr PHP Developer (Full-stack),Full Time,b0248344-89e5-11e8-87e5-7d6aa5fe3ed0,https://jobs.github.com/positions/b0248344-89e5-11e8-87e5-7d6aa5fe3ed0,"Jacksonville, FL (Or Remote)",--,,--,Github Jobs
Shell,Fri Nov 16 13:03:53 UTC 2018,"Blockchain Analyst | Part of Shell Graduate Programme
Location: Amsterdam
Summary
Part of our highly-reputed Graduate Programme, this placement in our Blockchain Centre of Excellence (CoE) is a chance to learn alongside some of the best minds and developers in the blockchain space and build your blockchain knowledge. You’ll be exploring potential applications across Shell – from supply chain and certification to mobility and energy.
The placement
In this placement, you’ll gain the skills to be a successful Blockchain Analyst with us. It’s a great time to join this new team – we’re still at the stage where we can educate colleagues and refine our strategy. Highlights include:

Exploring potential applications – whether that’s in our core gas and oil business or new areas such as new energies or electric vehicles.
Assisting on projects from ideation to deployment, working with bright, experienced analysts.
Carrying out market scans on new decentralised technology primitives.
Creating value cases for opportunities for blockchain in different business areas.
Helping shape the team’s approach and way of working.

This is the first of two Graduate Programme placements; your second could be in data engineering, data analytics, IT Architecture or a similar part of our business.
Who are you?
Obviously, some insight into blockchain would be useful, but it’s not essential: we can bring you up to speed. You probably you have a background in Computer Science or Information Management but we’re also open to hearing from cryptographers, mathematicians or game theorists.
You’ll be part of a start-up culture where we sometimes ‘colour outside the lines’ – that’s something you’ll need to embrace. To thrive here, you’ll definitely need to be able to think on your feet – you’re someone who loves coming up with original ideas and exploring different angles to solve a problem.
The Shell Graduate Programme: a world of opportunities
Join the IT Shell Graduate Programme and you can look forward to an industry-leading two- or three-year learning programme, offering real responsibility, engaging challenges and continued professional development.
There’s never been a more exciting time to be part of the energy industry. Start your career at Shell and immerse yourself in innovative projects to find economically, socially and environmentally responsible solutions to the world’s energy needs. You’ll be learning alongside brilliant people from all over the world, with the resources and support to explore new ways of thinking and working – all in all, an unbeatable experience.
Helping you prepare
We want you to be at your best when completing the assessments, so here are some top tips and some additional background information that may help you. Ace your application prep by reviewing our application tips.
Ready to apply?
If you’re excited by the chance to push boundaries and explore frontiers, click on this link:Click here to apply! to start you application. In the online application form, select “IT” as your preferred area of interest.
",,--,"Click here to apply!
",Blockchain Analyst | Part of the Shell Graduate Programme,Full Time,f8c3413e-e99f-11e8-85e7-1cb84dad80e6,https://jobs.github.com/positions/f8c3413e-e99f-11e8-85e7-1cb84dad80e6,Amsterdam,--,,--,Github Jobs
Piktochart Sdn Bhd,Fri Nov 16 08:41:52 UTC 2018,"Dear server/database admin, you’ve arrived at the opening where challenge meets excitement. Piktochart is a growing startup and we work to serve our users so that they can create infographics on a daily basis with ease. If you have a strong passion for scaling web apps and application security, we need your help on our server operations!
Your mission:
Design scalable and secure web infrastructure on GCP &amp; AWS clouds
Monitor system and network health
Deploy containerized applications on Kubernetes
Analyze software performance and perform system/code optimization
Design and scale database systems
Automate server management using tools like Ansible or Saltstack
Participate in service capacity planning and demand forecasting
You offer :
3+ years experience with distributed Unix/Linux environments, preferably Ubuntu or Debian
Familiarity with Amazon and Google clouds
Experience with Docker and container orchestration platforms
Experience with scaling MySQL, PostgreSQL, Redis and Memcached clusters
Familiar with Ruby on Rails web framework
Strong knowledge of web application security
Bash and Python scripting
Knowledge of Nginx, HAProxy
Knowledge of Ansible / Chef / Puppet
Knowledge of Elasticsearch stack
Extra points if you have:
Experience with CI services, CircleCI / Jenkins
Experience with Golang, Nodejs
Experience with Agile practices (Scrum, Kanban)
Knowledge of Nagios / Statd / Graphite
High self-learning ability to adapt to emergency circumstances
Ability to manage multiple issues at once and keep your team updated on what's going on
Knowledge in backup/restore operations
Location :
Remote (Already based in Europe or willing to work in EU timezone)
",,--,"Apply here : https://grnh.se/e0769a2c1
",DevOps (Remote - Europe),Full Time,2744c836-e97b-11e8-8236-5be6ba23f176,https://jobs.github.com/positions/2744c836-e97b-11e8-8236-5be6ba23f176,Europe,--,,--,Github Jobs
Acadian Asset Management,Thu Nov 15 19:33:10 UTC 2018,"Position Overview:
We are looking for a senior quantitative developer to join our Multi-Asset Class Strategies (MACS) team, who will own all aspects of quantitative model development for the team – including design, implementation, visualization and maintenance. MACS is a new and growing business at Acadian and focuses on all major global asset classes including: Equities, Fixed Income, Currencies, Commodities and Options/Volatility. As a member of the investment team, this person will closely collaborate with PMs and quantitative researchers and will have opportunities to contribute to research and investment decisions.
Responsibilities:

Responsible for all aspects of quantitative model development for the MACS Team
Work with PMs and researchers to design and implement sophisticated quantitative multi-asset models
Design and implement state of the art model visualization capabilities
Maintain all aspects of the models including daily production jobs
Build systems to gather, cleanse and integrate data from various sources
Apply advanced algorithms from the field of quantitative finance and computational science to assist in the research of macroeconomic and financial variables
Contribute to the MACS research agenda and investment decisions

Qualifications:

Minimum 7+ years of experience as a quantitative developer for an investment firm
Master’s degree with an outstanding academic record in a technical field such as mathematics, science or engineering; PhD degree preferred
Hands on development experience with Python (Pandas, Numpy) for modeling/analytical work and SQL for data access and architecture; JavaScript experience for visualization a plus
Very strong mathematical skills; experience with Bayesian estimation and optimization is a plus
Proficiency in multi-asset class data series and operating data delivery platforms
Superior software, database design and programming skills to move quickly from concept to solution
World-class analytic skills and the ability to clearly articulate approach, process and results in verbal, graphical and written form
Creativity, enthusiasm, collegiality and the ability to excel in a self-starting environment
Drive and humility to deliver on high value projects and roll up your sleeves attitude

It is the policy of Acadian Asset Management LLC to provide equal employment opportunity to all qualified persons without regard to race, creed, color, sex, age, national origin, marital status, veteran status, citizenship status, disability, or sexual orientation.
",,--,"https://www.acadian-asset.com/careers
","Senior Quantitative Developer, Multi-Asset Class Strategies ",Full Time,28dec9da-e90d-11e8-8317-fd99c2c2fb01,https://jobs.github.com/positions/28dec9da-e90d-11e8-8317-fd99c2c2fb01,"Boston, MA",--,,--,Github Jobs
Acadian Asset Management,Thu Nov 15 19:26:24 UTC 2018,"Position Overview:
We are seeking an experienced Software Engineer to help us design and build Acadian’s advanced browser-based, interactive, analytical platform that helps us better understand, explain, and improve our quantitative investment process. This is a hands-on, full-stack development role that provides growth and learning opportunities. The Software Engineer will utilize and hone a variety of technical skills while gaining and applying quantitative investment knowledge. Our small team is embedded within the investment group, providing the opportunity to see your work in action. Join us to leverage your software development skills and work with world class technology and investment experts.
Responsibilities:

Design, build, test, and support multi-tiered distributed, clustered, web-based applications and platforms
Engineer, design, and build scalable, interactive, responsive, informative, and beautiful data visualization and exploration tools
Team up with quantitative portfolio managers and researchers to develop and execute process improvement initiatives through software development

Qualifications:

Experience building browser-based applications using JavaScript, CSS, and HTML
Experience programming using a server-side scripting language such as Python (Node, Ruby, Julia, etc.)
Degree in Computer Science or equivalent knowledge and technical work experience
Hands on experience running http server such as Apache / NGINX
Prior investment/financial industry knowledge is not required

Other technologies we use:

SQL, NoSQL, MongoDB, Redis
Numpy, Scipy, Pandas
D3, AngularJS, Node
Docker, Slurm, ZeroMQ, AWS

It is the policy of Acadian Asset Management LLC to provide equal employment opportunity to all qualified persons without regard to race, creed, color, sex, age, national origin, marital status, veteran status, citizenship status, disability, or sexual orientation.
",,--,"https://www.acadian-asset.com/careers
",Full Stack Developer & Senior Analyst (Investment Analytics),Full Time,47328346-e90c-11e8-9429-c09930ae6ec9,https://jobs.github.com/positions/47328346-e90c-11e8-9429-c09930ae6ec9,"Boston, MA",--,,--,Github Jobs
Revive Interior,Thu Nov 15 14:52:36 UTC 2018,"Junior Full-Stack Developer (full-time)
Revive Interior GmbH is an innovative e-commerce company that specializes in reupholstering and selling exclusive used designer furniture. Every step of the process is done inhouse, from buying, reupholstering and photographing up to white-glove fulfillment directly to our customers living-rooms. Our vision is to establish Revive Interior as a globally recognized brand for used furniture and to provide the best alternative for buying new furniture. We strongly believe that small things can have a big impact.
This is why we give 10% of our annual profits to charity.
about the job
You love solving real-world problems in an innovative and long-term way?
You accelerate in an almost non-hierarchical, specialized team?
You have experience in building scalable software solutions, not forgetting about performance and security?
You love to learn new things and like to challenge the status quo?
Then we want you to join us on our mission!
your responsibilities

transform business needs well into code
working with e-commerce platforms such as WooCommerce &amp; Magento in addition to connecting to other market and distribution places
working with git will be your daily routine

your skill

good understanding of SQL and Relational Databases
you are experienced in PHP, favorably Laravel
working with HTML, CSS and JavaScript is your bread and butter
you understand the basics of TDD
experience with Linux, Docker, nginx &amp; Vue.js is a bonus
you are able to communicate well and fast with your team

we offer

a small and specialized team in a scaling company with a start-up vibe
the ability to make your mark in our IT-infrastructure
daily free lunch cooked by our own chef Erika
50% discounted JobTicket for public transportation

Sounds exciting? Don’t hesitate to apply at: job@reviveinterior.de
We are looking forward to get to know you.
Contact
Jessica Aleo
Assistentant of the CEO
Revive Interior GmbH
Ottostraße 3
50859 Köln-Lövenich
www.revive.de
",,--,"job@reviveinterior.de
",Junior Full-Stack Developer (full-time),Full Time,02ff2dda-e8e6-11e8-9142-4af8e5c3597d,https://jobs.github.com/positions/02ff2dda-e8e6-11e8-9142-4af8e5c3597d,Cologne - Germany,--,,--,Github Jobs
Stylight GmbH,Thu Nov 15 13:22:21 UTC 2018,"For our office in Munich, we are looking for a Software Engineer to join our team. If you like thinking outside the box and collaborating with teammates to develop solutions to complex problems— this is the place for you!
Your Team

Works in an Agile environment to create internal tools in diverse areas such as performance marketing, SEO, and editorial content marketing.
Codes primarily in Python (mostly for backend applications) and is committed to the quality and health of their codebase.
Values the learning and growth mindset and has dedicated time for self-driven, personal development.
Has low management overhead and a high level of trust in one another; enjoys autonomous work as well as pair programming.

Your Responsibilities

Consider complex logical problems and develop pragmatic solutions with regard to relative effort and business value.
Continue to breakup a monolithic app into microservices while creating APIs used by other teams in Stylight’s value chain.
Own service stacks from design, development, &amp; testing to continuous integration, monitoring, &amp; user support.
Explain technical concepts to non-technical colleagues.

Your Profile

We hope you love Python and have experience with it too!  If not, we expect you to have a strong desire to learn and significant experience in another programming language.
You have a background in computer science either from a bachelor's degree program and/or work experience.
You have proficient English skills and are able to communicate honestly and openly with your colleagues.
You are a motivated, compassionate individual who enjoys collaboration and is eager to learn from and teach others.
SQL experience is a nice plus.

Why join Stylight?

We have an international, fun, and inclusive culture!  Our team represents over 20 nationalities.
We are family-friendly and enjoy spending time with one another outside of working hours from board game evenings and BBQs to ping pong tournaments and Christmas tree decorating.
Stylight is #1 Meetup organizer in Munich, deeply involved in the local tech community, and organizer of daho.am, our own annual developer conference.
A personal development budget is given to you to use throughout the year for personal growth.
We have a beautiful office space which is in the city-center, just a 10-minute walk to the nearest Biergarten.
Want to know more? Check out: about.stylight.com and tech.stylight.com.

Up for the Challenge?
Then don’t hesitate and apply today at about.stylight.com/jobs. We look forward to your complete application (CV, cover letter)! Your contact: Carina Meyer.
",,--,"Please apply at about.stylight.com/jobs!
",Software Engineer (m/f),Full Time,728d85b4-e8d9-11e8-95cd-f13299063e9d,https://jobs.github.com/positions/728d85b4-e8d9-11e8-95cd-f13299063e9d,"Munich, Germany",--,,--,Github Jobs
Stylight GmbH,Thu Nov 15 13:12:21 UTC 2018,"We are looking for an experienced Software Engineer to join our team in Munich. You’re interested in further optimizing and automating the technical integration of our partner shops and delivering high quality software is your number one priority? Then Stylight is your place to be.
Your Team

Is responsible for automating and continuously improving the technical integration tools and systems used by our business and finance teams as well as hundreds of business partners.
Codes primarily in Python (mostly for backend applications) and Javascript (for interactive UIs) and is committed to the quality and health of their codebase.
Works in an agile and cross-functional environment alongside our sales and partner managers.
Enjoys autonomous work as well as pair programming, code reviews and learning together.

Your Responsibilities

Ensuring your team ships quality products and code in accordance with business needs.
Build, maintain, and monitor our scalable architecture. We take pride in building highly performant and failure resistant platforms with a small team.
Own services from design, development, and testing to continuous integration, monitoring, and support.
Enjoy what you do, and be ready to research and learn new technologies.
Explain technical topics to non-technical colleagues and advocate for your team across the company.
Mentor, lead, and support other engineers to foster technical excellence in the team. Bring your best practices, challenge the status quo, and set things in motion.

Your Profile

You bring hands-on experience in software development, ideally 5+ years and have experience in designing, building and operating complex, scalable systems.
You have significant Python experience and are ready to share what you’ve learned with others.
You want to take responsibility and ownership for the software you produce. “You build it, you run it!” is our general philosophy.
You are opinionated and outspoken on engineering best practices, but can still maintain friends.
You have solid experience with both relational and NoSQL databases.
You have proficient English skills and are able to communicate honestly and openly with your colleagues.
You’re excited to work in an environment where collaboration, continuous integration and delivery are as vital as morning coffee.
Experience with Docker, AWS, and microservice architectures are a very nice plus.

Why join Stylight?

Stylight is #1 Meetup organizer in Munich, and deeply involved in the local tech community.
We organize daho.am, our own annual developer conference. Top-notch speakers and over 1,000 attendees.
International &amp; highly motivated environment with open business culture in all departments.
Hands-on work after quick ramp up &amp; openness to new solutions and improvements.
A personal development budget is given to you to use throughout the year for personal growth.
We have one of the coolest office spaces in Munich (and actually in Germany).
Experience Munich: Our office is in the city-center, and just a 10-minute walk to the nearest Biergarten.
Want to know more? Check out: about.stylight.com and tech.stylight.com.

Up for the Challenge?
Then do not hesitate and apply today on about.stylight.com/jobs. We are looking forward to receiving your complete application (CV, cover letter) in English or German! Your contact: Carina Meyer.
",,--,"Please apply at about.stylight.com/jobs!
",Senior Software Engineer (m/f),Full Time,0b6885c4-e8d8-11e8-96fd-a4688df0d66b,https://jobs.github.com/positions/0b6885c4-e8d8-11e8-96fd-a4688df0d66b,"Munich, Germany",--,,--,Github Jobs
Stylight GmbH,Thu Nov 15 13:00:53 UTC 2018,"We are looking for a Lead Software Engineer to join our team in Munich. You’re interested in further optimizing and automating the technical integration of our partner shops and delivering high quality software is your number one priority? Then Stylight is your place to be.
Your Team

Is responsible for automating and continuously improving the technical integration tools and systems used by our business and finance teams as well as hundreds of business partners.
Codes primarily in Python (mostly for backend applications) and Javascript (for interactive UIs) and is committed to the quality and health of their codebase.
Works in an agile and cross-functional environment alongside our sales and partner managers.
Enjoys autonomous work as well as pair programming, code reviews and learning together.

Your Responsibilities

Ensuring your team ships quality products and code in accordance with business needs.
Build, maintain, and monitor our scalable architecture. We take pride in building highly performant and failure resistant platforms with a small team.
Own services from design, development, and testing to continuous integration, monitoring, and support.
Enjoy what you do, and be ready to research and learn new technologies.
Explain technical topics to non-technical colleagues and advocate for your team across the company.
Mentor, lead, and support other engineers to foster technical excellence in the team. Bring your best practices, challenge the status quo, and set things in motion.

Your Profile

You bring hands-on experience in software development, ideally 5+ years and have experience in designing, building and operating complex, scalable systems.
You have significant Python experience and are ready to share what you’ve learned with others.
You want to take responsibility and ownership for the software you produce. “You build it, you run it!” is our general philosophy.
You are opinionated and outspoken on engineering best practices, but can still maintain friends.
You have solid experience with both relational and NoSQL databases.
You have proficient English skills and are able to communicate honestly and openly with your colleagues.
You’re excited to work in an environment where collaboration, continuous integration and delivery are as vital as morning coffee.
Experience with Docker, AWS, and microservice architectures are a very nice plus.

Why join Stylight?

Stylight is #1 Meetup organizer in Munich, and deeply involved in the local tech community.
We organize daho.am, our own annual developer conference. Top-notch speakers and over 1,000 attendees.
International &amp; highly motivated environment with open business culture in all departments.
Hands-on work after quick ramp up &amp; openness to new solutions and improvements.
A personal development budget is given to you to use throughout the year for personal growth.
We have one of the coolest office spaces in Munich (and actually in Germany).
Experience Munich: Our office is in the city-center, and just a 10-minute walk to the nearest Biergarten.
Want to know more? Check out: about.stylight.com and tech.stylight.com.

Up for the Challenge?
Then do not hesitate and apply today! We are looking forward to receiving your complete application (CV, cover letter) in English or German! Your contact: Carina Meyer.
",,--,"Pleas apply at about.stylight.com/jobs!
",Lead Engineer (m/f),Full Time,62f8d66a-e8d6-11e8-9847-c1b90d211139,https://jobs.github.com/positions/62f8d66a-e8d6-11e8-9847-c1b90d211139,"Munich, Germany",--,,--,Github Jobs
